{
    "$schema": "http://json-schema.org/draft-07/schema#",
    "title": "Apps with jailbreak detection",
    "description": "Description of an app with jailbreak detection",

    "type": "object",
    "additionalProperties": false,
    "properties": {
        "name": {"type": "string"},
        "bundleId": {"type": "string"},
        "uri": {"type": "string", "format": "uri"},
        "icon": {"type": "string", "format": "uri"},
        "notes": {"type": "string"},
        "aliases": {
            "type": "array",
            "minItems": 1,
            "uniqueItems": true,
            "items": {"type": "string"}
        },
        "bypasses": {
            "anyOf": [
                {"type": "null"},
                {
                    "type": "array",
                    "uniqueItems": true,
                    "minItems": 1,
                    "items": {
                        "type": "object",
                        "additionalProperties": false,
                        "properties": {
                            "name": {"type": "string"},
                            "notes": {"type": "string"},
                            "version": {"type": "string"}
                        }
                    }
                }
            ]
        }
    }
}