{
    "name": "Netflix",
    "bundleId": "com.netflix.Netflix",
    "uri": "https://apps.apple.com/us/app/netflix/id363590051",
    "icon": "https://is2-ssl.mzstatic.com/image/thumb/Purple116/v4/95/7a/b2/957ab2bb-2080-fccc-e494-b5ef28572cf2/source/512x512bb.jpg",
    "bypasses": [
        {
            "name": "Choicy"
        },
        {
            "name": "libhooker-configurator"
        },
        {
            "notes": "Looks like jailbreak detection has been removed from the app; however, raise an issue on GitHub if you find any trouble."
        }
    ]
}