{
    "name": "Deutsche Bank Mobile",
    "bundleId": "com.db.pbc.ng.mobile",
    "uri": "https://apps.apple.com/us/app/deutsche-bank-mobile/id1040475847",
    "icon": "https://is2-ssl.mzstatic.com/image/thumb/Purple126/v4/b9/43/38/b9433800-3c28-9264-6bad-bf7bff26e623/source/512x512bb.jpg",
    "bypasses": [
        {
            "name": "A-Bypass"
        },
        {
            "name": "Shadow"
        }
    ]
}